Unnamed: 0,question,single_answer,single_cost,single_duration,routed_answer,routed_cost,routed_duration,single_score,routed_score
13,What are the best practices for designing conversational memory in multi-turn interactions?,"To effectively implement conversational memory in multi-turn dialogues, several key strategies are outlined:

1. **Reflection Mechanism**: This involves synthesizing memories into higher-level inferences over time to guide the agent's future behavior. It moves beyond just remembering facts, to creating summaries of past events which help inform decision-making.

2. **Contextual Retrieval**: The agent uses a retrieval model that surfaces context according to relevance, recency, and importance. This ensures that the most pertinent memories are considered during interactions. Recency ensures recent events have a higher impact, while importance distinguishes mundane memories from core ones.

3. **Planning and Reacting**: Reflections and insights from the conversation are translated into actions. Such planning is aimed to optimize both momentary believability and long-term coherence in dialogues. Relationships and observations among agents influence planning and responding, encouraging emergent social behaviors like maintaining conversation topics or coordinating events.

4. **Chain of Hindsight (CoH)**: This strategy encourages an agent to refine its outputs by reflecting on past actions. It involves learning from feedback on previous responses and refining the agent's capabilities through supervised fine-tuning on sequences of past outputs, each annotated with feedback.

5. **Environment Integration**: Embedding the information about the environment in which agents operate in a structured format, such as a tree, allows for an enriched context for dialogues, aiding in more realistic and coherent interactions.

6. **Memory Stream**: This serves as a long-term memory module that records experiences in natural language, forming a base for informed future interactions. Observations and events form entries, and interactions with other agents can generate new dialogue outcomes.

By combining these strategies, conversational systems can achieve more realistic, coherent, and context-sensitive discussions, thereby enhancing the user's engagement and interaction quality.",0.0107249999999999,11082055.0,"In the context of conversational systems, effective retention and utilization of information from multiple turns can be achieved by incorporating memory mechanisms and planning models. According to research on Generative Agents (Park, et al., 2023), these systems can enhance their response quality and coherence through several key features:

1. **Memory Stream**: This is a long-term memory module that records a comprehensive list of an agent’s experiences in natural language. These memories consist of observations or events that the agent has directly participated in.

2. **Retrieval Model**: This model helps in surfacing the most relevant information based on criteria such as recency, importance, and relevance. More recent events and significant memories are prioritized, while the relevance is determined by the relatedness to the current query.

3. **Reflection Mechanism**: Agents synthesize memories into higher-level inferences over time. This guides their future behaviors by generating summaries of past events, which can then be translated into actions or used to formulate new responses.

4. **Planning & Reacting**: This aspect involves translating reflections and environmental information into deliberate actions. Planning occurs to optimize both real-time interactions and long-term agent behavior.

5. **Natural Language Interface**: To maintain coherence and reliability in interactions, language models function as interfaces between the agents' memories and external components or tools, mitigating limitations like formatting errors or rebellious behavior in language models.

By blending these elements, conversational systems can effectively build and utilize a contextual understanding of interactions, ensuring more coherent and contextually relevant responses over multiple turns. These strategies also depict how agents simulate human-like interaction dynamics, such as information diffusion and social event coordination.",9.108e-05,5156445.0,9.0,9.0
14,How do different routing strategies affect the performance of multi-agent LLM systems?,"In an LLM-powered autonomous agent system, the routing strategy significantly impacts efficiency and effectiveness. The system, described as a MRKL (Modular, Rational, Knowledge, and Learning) architecture, uses a general-purpose LLM to route inquiries to appropriate expert modules, which can be neural (e.g., deep learning models) or symbolic (e.g., math calculators, currency converters, weather APIs). The effectiveness of this system largely depends on the LLM's ability to determine when and how to use these external tools and APIs. Experiments indicate challenges in reliably extracting information for tasks like arithmetic, highlighting the importance of leveraging external tools when suitable. Furthermore, effective routing allows the LLM to plan tasks, decompose them into manageable subgoals, and execute them effectively, impacting the agents' overall performance.",0.020871,25981358.0,"In multi-agent large language model (LLM) systems, the choice of routing mechanism significantly impacts efficiency and effectiveness through various factors such as communication overhead, response latency, and overall task completion time. A MRKL (Modular Reasoning, Knowledge, and Language) system serves as a notable example; it consists of ""expert"" modules, each tasked with specific functions, while a general-purpose LLM acts as a router, directing inquiries to the most suitable module. These modules can either be neural (e.g., deep learning models) or symbolic (e.g., calculators, APIs).

The routing mechanism plays a crucial role in determining whether the system can effectively solve tasks by matching them with the right resources. For instance, experiments have demonstrated that LLMs may struggle with tasks like verbal math problems where they fail to extract the correct arguments needed for basic arithmetic operations. The routing mechanism must account for the capabilities of both the LLM and the expert modules it engages with, indicating that systems fine-tuned to work with external APIs, such as Tool Augmented Language Models (TALM) or Toolformer, are better positioned to handle complex tasks.

Moreover, the efficiency of such systems is further refined by well-designed task planning processes, as illustrated by frameworks like HuggingGPT, which employ a LLM to parse user requests into multiple tasks, vetted by few-shot examples to guide task parsing and planning. These involve considering factors such as task type, dependencies, and arguments. As a result, the routing mechanism's design can heavily influence communication overhead through the frequency and complexity of interactions among agents and modules, response latency based on task complexity and module readiness, and task completion time by optimizing the sequence and allocation of tasks to appropriate modules.

Therefore, the selection and design of a routing mechanism in multi-agent LLM systems are pivotal to enhancing system efficiency and effectiveness, especially as these systems scale in complexity and application scope.",0.0001014299999999,4253129.0,8.0,9.0
15,What techniques are used to ensure consistency in long-running autonomous agent tasks?,"To maintain consistency in tasks performed by autonomous agents over extended periods, several methods are employed:

1. **Planning and Task Decomposition**: Agents break down large tasks into smaller, manageable subgoals for efficient handling. Techniques like Chain of Thought (CoT) and Tree of Thoughts are used to decompose complex tasks into simpler steps.

2. **Self-Reflection**: Agents engage in self-criticism and reflection over past actions, learning from mistakes to improve future steps. This iterative refinement helps in improving decision quality and task consistency.

3. **Memory Management**: Utilizing both short-term and long-term memory, agents retain and recall information over extended periods. Long-term memory involves leveraging an external vector store for fast retrieval, ensuring that agents can consistently build on past experiences.

4. **Tool Use**: Agents learn to call external APIs for information not contained within the model's weights, such as current data and proprietary information. This is crucial for maintaining task consistency when external information is necessary.

Collectively, these components—planning, reflection, memory, and tool use—form a robust framework that ensures the consistency of tasks performed by autonomous agents over time.",0.011439,11210612.0,"In a LLM-powered autonomous agent system, consistency in executing long-term tasks can be maintained through several key components: 

**1. Planning:** The agent decomposes large tasks into smaller, manageable subgoals, allowing for efficient handling of complexity. It undergoes a cycle of reflection and refinement, engaging in self-criticism and learning from past mistakes to enhance future performance.

**2. Memory:**
   - **Short-term memory** involves in-context learning to dynamically adapt based on recent inputs.
   - **Long-term memory** allows the agent to retain and recall extensive information over time using an external vector store for fast retrieval, ensuring the agent remains informed and updated.

**3. Tool Use:** The agent leverages external APIs for information not pre-trained within the model, such as executing code, accessing proprietary databases, and integrating current information.

By combining LLM's capabilities with planning, memory, and tool integration, agents can remain consistent and effective over long-term tasks. This structure not only enables problem-solving but also augments the agent’s adaptability and reliability, crucial for maintaining consistency over time.",8.594999999999999e-05,7294064.0,9.0,9.0
16,How can we implement effective feedback loops for continuous learning in autonomous agents?,"Relevant Content:
A strategy for facilitating continuous learning in autonomous agents is the Chain of Hindsight (CoH; Liu et al., 2023), which encourages models to improve on their own outputs by presenting a sequence of past outputs annotated with feedback. Human feedback data is collected, comprising tuples of prompt, model completion, human rating, and human feedback. The model undergoes supervised fine-tuning to predict improved outputs based on feedback sequences, incorporating self-reflection to enhance performance. Additionally, multiple rounds of instructions from human annotators can be provided during testing to improve model performance further.

Another strategy is the Reflexion framework (Shinn & Labash, 2023) that equips agents with dynamic memory and self-reflection capabilities. The setup includes a reward model providing binary rewards and an action space that encompasses both task-specific discrete actions and language-based reasoning steps (as seen in ReAct by Yao et al., 2023). Self-reflection helps determine when a trajectory is inefficient or hallucinatory, prompting the system to reset the environment and start anew.

Moreover, reflection mechanisms for synthesizing memories into high-level inferences are implemented to guide future behavior. These inferences serve as higher-level summaries of past events, prompting agents to react in consideration of past interactions and observations.

These methods, among others, support the continuous learning of agents by allowing them to self-improve through feedback and reflective processes, thus fostering more intelligent and adaptive decision-making capabilities in changing environments.",0.002637,2439598.0,"In designing and implementing robust, adaptable feedback mechanisms for autonomous agents, we can consider several techniques:

1. **Memory Stream and Long-term Planning:**
   - Implement a long-term memory module (external database) to record comprehensive experiences in natural language. This allows agents to accumulate knowledge over time.
   - Use planning and reaction models where relationships between agents and observations are considered. This approach helps optimize for both short-term and long-term goals, making decisions believable over time.

2. **Reflection Mechanism:**
   - This involves synthesizing memories into higher-level inferences over time, guiding future behavior. This may include analyzing recent observations or experiences and creating plans or reflections that inform future actions.
   - An agent might consult these reflections to adjust its behavior dynamically.

3. **Chain of Hindsight (CoH):**
   - CoH involves training models with sequential hindsight feedback, where past outputs are annotated with feedback. An agent can learn from its past actions to make better decisions over time.
   - This entails a sequence of model completions with human ratings, where each output is improved over the previous one through continuous feedback.

4. **Inter-agent Communication:**
   - Facilitate communication between agents to trigger new natural language statements, allowing cooperative learning and feedback exchange to inform individual and collective behavior.

5. **Retrieval Models for Context:**
   - Use a retrieval model to surface relevant, recent, and important context to the agent, thus providing feedback on what constitutes significant versus trivial information.

To measure the effectiveness of these feedback mechanisms, consider:
- Tracking the improvement in task performance over time.
- Analyzing the accuracy and reliability of action plans generated post-reflection.
- Monitoring behavior changes post-feedback and evaluating the degree of alignment with desired outcomes.
- Using success rates of task completions as a benchmark for learning effectiveness.

These strategies can be part of an adaptable system design that allows autonomous agents to improve through self-assessment and ongoing feedback, ultimately enhancing their performance continuously.",0.0113745899999999,18824353.0,9.0,9.0
17,What are the key considerations for scaling autonomous agent systems?,"LLM Powered Autonomous Agents | Lil'Log Table of Contents

Agent System Overview 
- In a LLM-powered autonomous agent system, LLM functions as the agent’s brain, complemented by several key components: 
  - Planning: Subgoal and decomposition where the agent breaks down large tasks into smaller, manageable subgoals, enabling efficient handling of complex tasks, and using reflection and refinement where the agent can do self-criticism and self-reflection over past actions, learn from mistakes and refine them for future steps, thereby improving the quality of final results.
  - Memory: Utilizes short-term memory of the model to learn and long-term memory that provides the agent with the capability to retain and recall (infinite) information over extended periods.
  - Tool use: The agent learns to call external APIs for extra information that is missing from the model weights, including current information, code execution capability, access to proprietary information sources and more.

Challenges: Issues like reliability where the reliability of model outputs is questionable, as LLMs may make formatting errors and occasionally exhibit rebellious behavior (e.g., refuse to follow an instruction).

Potentialities and Use Cases:
- Generative Agents Simulation: Used for interactive applications that require creating believable simulacra of human behavior, designed by combining LLM with memory, planning and reflection mechanisms.
- Inter-agent communication: Enables generating new natural language statements that can simulate human interactions.
- Memory stream and retrieval model: Helps to surface the context to inform the agent’s behavior based on relevance, recency, and importance.

The document discusses the importance of combining components such as planning, memory, and tool usage with LLMs to approach scaling autonomous agents effectively.",0.002604,3269524.0,"LLM Powered Autonomous Agents | Lil'Log

Table of Contents

Agent System Overview

Component One: Planning

Task Decomposition
Self-Reflection

Component Two: Memory

Types of Memory
Maximum Inner Product Search (MIPS)

Component Three: Tool Use

Case Studies

Scientific Discovery Agent
Generative Agents Simulation

Proof-of-Concept Examples

Challenges

Citation References

Building agents with LLM (large language model) as its core controller is a cool concept. Several proof-of-concepts demos, such as AutoGPT, GPT-Engineer and BabyAGI, serve as inspiring examples. The potentiality of LLM extends beyond generating well-written copies, stories, essays and programs; it can be framed as a powerful general problem solver.

Agent System Overview

In a LLM-powered autonomous agent system, LLM functions as the agent’s brain, complemented by several key components:

Planning

- Subgoal and decomposition: The agent breaks down large tasks into smaller, manageable subgoals, enabling efficient handling of complex tasks.
- Reflection and refinement: The agent can do self-criticism and self-reflection over past actions, learn from mistakes and refine them for future steps, thereby improving the quality of final results.

Memory

- Short-term memory: Utilizing in-context learning as a short-term memory of the model to learn.
- Long-term memory: Enables the agent to retain and recall extensive information over long periods, leveraging an external vector store and fast retrieval.

Tool use

- The agent learns to call external APIs for additional information that is not embedded in the model weights, such as current data, code execution capability, and access to proprietary information sources.

Fig. 1. Overview of a LLM-powered autonomous agent system.

Component One: Planning

A complicated task usually involves many steps. An agent needs to know what they are and plan ahead.

Challenges

- The reliability of model outputs is questionable, as LLMs may occasionally make formatting errors and rebellious behavior (e.g., refuse to follow an instruction).
- Much of the agent demo code focuses on parsing model output.

Agents may face further risks, such as in tasks of synthesizing chemical compounds, the risks of synthesizing illicit drugs and bioweapons were noted, with 36% of synthesis solutions accepted and some attempts rejected after web searches or based on prompt only.

- Generative agents create believable simulacra of human behavior for interactive applications, incorporating memory, planning, and reflection mechanisms to behave consistently based on past experience.

This content highlights the technical, organizational, and ethical challenges in scaling autonomous agent systems, including the reliability of outputs and planning efficient tasks, reflecting potential societal impacts and risks associated with misuse, which are central to the question asked.",0.01327188,16370002.0,7.0,7.0
18,How do autonomous agents handle uncertainty and ambiguity in task execution?,"In LLM-powered autonomous agent systems, strategies to manage uncertainty and ambiguity during task execution involve several components:

1. **Planning**: Agents break down large tasks into smaller, manageable subgoals, facilitating efficient handling of complex tasks. They also engage in reflection and refinement, where they perform self-criticism and self-reflection to learn from past mistakes, improving future outcomes.

2. **Memory**: Memory is crucial in managing uncertainty. There are different types: 
   - **Short-term memory** is used for in-context learning, allowing the agent to handle immediate tasks.
   - **Long-term memory** allows agents to retain and recall extensive information over periods, often using external vector stores and fast retrieval.

3. **Tool Use**: Agents use external APIs to access information not contained within the model's weights. This includes retrieving current information, executing code, and accessing proprietary sources.

4. **Reflection Mechanism**: This synthesizes memories into higher-level inferences over time, guiding the agent’s future actions. It involves generating salient high-level questions based on past observations and prompting language models to answer these questions.

These components ensure that agents can effectively manage uncertainties by planning, leveraging memory, utilizing external tools, and reflecting on past experiences. The approach aims to optimize behavior both in the present and over time, improving agent performance in uncertain and ambiguous environments.",0.046827,54279677.0,"In the context of LLM-powered autonomous agents, managing uncertainty and ambiguity during the execution of complex tasks involves several key strategies:

1. **Planning and Task Decomposition**: The agent breaks down large tasks into smaller, manageable subgoals, enabling efficient handling of complex tasks. This process allows the agent to manage uncertainty by taking on smaller and more controlled tasks at a time.

2. **Self-Reflection and Refinement**: Agents engage in self-criticism and reflection on past actions. They learn from any mistakes made and refine their strategies for future tasks to improve the outcomes. This continual learning process helps in mitigating errors and improving the reliability of the agent's performance.

3. **Memory Management**:
   - **Short-Term Memory**: Utilized during in-context learning, helping the agent adapt to new information specific to the current task.
   - **Long-Term Memory**: Facilitated by external vector stores and fast retrieval systems, allowing agents to retain and access vast amounts of information over time.

4. **Tool Use**: When encountering missing information or needing to perform actions beyond its internal capabilities, the agent can learn to call external APIs. This includes accessing real-time data, executing code, or utilizing other LLMs for information or capabilities not inherently available to the agent.

Through these strategies, autonomous agents can effectively manage uncertainties and ambiguities inherent in complex tasks, reducing the potential for errors and leading towards more optimal outcomes. This framework reflects a sophisticated integration of planning, memory usage, reflection, and external resources to enhance performance and adaptability in real-world applications.

Reference: Weng, Lilian. (Jun 2023). ""LLM-powered Autonomous Agents"". Lil’Log. https://lilianweng.github.io/posts/2023-06-23-agent/.",9.396e-05,4455023.0,9.0,9.0
19,What methods are used to evaluate and benchmark autonomous agent performance?,"The performance of autonomous agents can be assessed and compared using various techniques, often focusing on aspects such as planning, memory management, and tool usage. In a system where an autonomous agent powered by a large language model (LLM) is involved, the agent's ability to decompose tasks into manageable subgoals and reflect on past actions for improvement are key assessment criteria. Effective memory management, including both short-term and long-term memory, allows the agent to recall and utilize information efficiently. Furthermore, the ability to use external tools and APIs to access information beyond the model's intrinsic knowledge is another important metric. Generative agents, a type of LLM-powered simulation, also demonstrate emergent social behaviors such as information diffusion and relationship memory, providing additional avenues for evaluation. Assessing these capabilities can often involve monitoring the success rate of task completions, the quality of synthesized solutions, and the agent's interaction dynamics within a simulated environment.",0.010785,6257584.0,"In evaluating and comparing the performance of autonomous agents, several components are considered, particularly in the context of LLM-powered autonomous agents. These components include:

1. **Planning**: 
   - Subgoal and decomposition: Agents break down large tasks into smaller, manageable subgoals, enabling efficient handling of complex tasks.
   - Reflection and refinement: Agents can do self-criticism and self-reflection over past actions, learn from mistakes, and refine them for future steps, thereby improving the quality of results.

2. **Memory**:
   - Short-term memory: In-context learning as utilizing the model's short-term memory.
   - Long-term memory: Retaining and recalling information over extended periods with the use of an external vector store and fast retrieval.

3. **Tool use**: 
   - Learning to call external APIs for additional information missing from the model weights.

For generative agents, evaluation is based on simulations that mimic human behaviors and interactions, like those in ""The Sims"". This involves:
- Memory streams that record comprehensive experiences.
- Retrieval models surfacing context relevant to the agent’s behavior.
  
Evaluation benchmarks often include testing on problem-solving tasks, human-like behavior reproduction, interaction capabilities with other agents, and adaptability to new information. The benchmarks ensure that agents manage tasks efficiently, learn from interactions, apply relevant past experiences, and improve decision-making processes.",0.02862822,19932995.0,8.0,9.0
