Unnamed: 0,question,single_answer,single_cost,single_duration,routed_answer,routed_cost,routed_duration,single_score,routed_score
0,What are the key components of an LLM-powered autonomous agent system?,"In a LLM-powered autonomous agent system, the large language model (LLM) functions as the agent’s brain, supported by several key components:

1. **Planning**: 
    - Subgoal and Task Decomposition: The agent breaks down large tasks into smaller, manageable subgoals, enabling efficient handling of complex tasks.
    - Reflection and Refinement: The agent engages in self-criticism and self-reflection over past actions, learns from mistakes, and refines methods for future steps, thus improving the quality of final results.

2. **Memory**:
    - Short-term Memory: This is akin to in-context learning, where the model utilizes its capacity to learn and make decisions based on current context.
    - Long-term Memory: This equips the agent with the capability to retain and recall information over extended periods, often by incorporating an external vector store for fast retrieval.

3. **Tool Use**:
    - The agent learns to call external APIs for additional information missing from the model weights, enabling capabilities such as current information retrieval, code execution, and access to proprietary data sources.

Several proof-of-concept demos, including AutoGPT, GPT-Engineer, and BabyAGI, illustrate the potential of LLMs as powerful general problem solvers, extending beyond generating well-written outputs to being the core of autonomous agent systems. These systems emphasize the integration of planning, memory, and tool usage, allowing the LLM to function effectively as an autonomous entity.",0.013791,20800575.0,"In a LLM-powered autonomous agent system, the LLM functions as the agent’s brain, complemented by several key components:

1. **Planning**
   - **Subgoal and Decomposition**: The agent breaks down large tasks into smaller, manageable subgoals, enabling efficient handling of complex tasks.
   - **Reflection and Refinement**: The agent can do self-criticism and self-reflection over past actions, learn from mistakes, and refine them for future steps, thereby improving the quality of final results.

2. **Memory**
   - **Short-term Memory**: Utilizes in-context learning (see prompt engineering) as short-term memory to learn.
   - **Long-term Memory**: Provides the capability to retain and recall information over extended periods, often by leveraging an external vector store and fast retrieval.

3. **Tool Use**
   - The agent learns to call external APIs for missing information not included in the model weights, like current information or proprietary sources.

4. **Task Planning** (as seen in frameworks like HuggingGPT)
   - The system comprises four stages where LLM acts as the brain to parse user requests into multiple tasks. This involves task type identification, dependency management, and argument specification.

In addition to these components, the architecture emphasizes the use of natural language as an interface between LLMs and external components such as memory and tools, although caution is advised with model outputs due to potential reliability issues. This system design highlights the role of LLMs not just in generating content, but as general problem solvers that can navigate through complex, multi-step tasks using strategic planning, memory management, and external tool integration.",8.864999999999999e-05,4163938.0,9.0,9.0
1,How does the Chain of Thought (CoT) prompting technique enhance model performance in task decomposition?,"Task Decomposition: Chain of thought (CoT; Wei et al. 2022) has become a standard prompting technique for enhancing model performance on complex tasks. The model is instructed to “think step by step” to utilize more test-time computation to decompose hard tasks into smaller and simpler steps. CoT transforms big tasks into multiple manageable tasks and sheds light on an interpretation of the model’s thinking process. Tree of Thoughts (Yao et al. 2023) extends CoT by exploring multiple reasoning possibilities at each step. It first decomposes the problem into multiple thought steps and generates multiple thoughts per step, creating a tree structure. The search process can be BFS (breadth-first search) or DFS (depth-first search) with each state evaluated by a classifier (via a prompt) or majority vote. Task decomposition can be done (1) by LLM with simple prompting like ""Steps for XYZ.n1."", ""What are the subgoals for achieving XYZ?"", (2) by using task-specific instructions; e.g. ""Write a story outline."" for writing a novel, or (3) with human inputs. Another quite distinct approach, LLM+P (Liu et al. 2023), involves relying on an external classical planner to do long-horizon planning. This approach utilizes the Planning Domain Definition Language (PDDL) as an intermediate interface to describe the planning problem. In this process, LLM (1) translates the problem into “Problem PDDL”, then (2) requests a classical planner to generate a PDDL plan based on an existing “Domain PDDL”, and finally (3) translates the PDDL plan back into natural language. Essentially, the planning step is outsourced to an external tool, assuming the availability of domain-specific PDDL and a suitable planner which is common in certain robotic setups but not in many other domains.",0.003087,3211506.0,"Chain of thought (CoT) prompting, as mentioned in sources such as Wei et al. (2022), is a standard technique for enhancing large language models' performance on complex tasks. This approach involves instructing the model to “think step by step,” thereby utilizing more test-time computation to break down hard tasks into smaller, more manageable sub-problems. By doing so, CoT transforms big tasks into multiple manageable tasks, rendering the model's thinking process more interpretable.

The process typically involves prompting the model using task-specific instructions or simple prompts like ""What are the subgoals for achieving XYZ?"", allowing for better decomposition of the problem. Furthermore, Tree of Thoughts (Yao et al. 2023) extends the CoT strategy by exploring multiple reasoning possibilities at each step, creating a tree structure to systematically explore these possibilities, which can be traversed using search strategies like BFS or DFS.

Additionally, empirical methods like the approach described by Shum et al. (2023), which involve augment-prune-select strategies, are employed to automatically construct chain-of-thought prompts. This involves generating multiple pseudo-chains of thoughts through few-shot or zero-shot CoT prompts, pruning them based on outcome matching, and applying a variance-reduced policy gradient strategy for selecting the most accurate examples.

By enabling the model to articulate reasoning as a sequence of deliberate steps, CoT prompting not only improves the accuracy and reliability of solutions but also enhances the model's ability to handle a diversity of complex problems in a more structured manner. This method leverages the broad capability of large language models to simulate human-like step-by-step reasoning, which is crucial for complex problem-solving and decision-making tasks.",9.954e-05,4848671.0,7.0,9.0
2,"What are some examples of external tools LLMs can use to extend their capabilities, as mentioned in the documents?","External tools that large language models (LLMs) can utilize to enhance their capabilities include a variety of modules and APIs. In a MRKL system, a collection of expert modules, which can be either neural (like deep learning models) or symbolic (such as a math calculator, currency converter, or weather API), are used. These modules are controlled by the LLM acting as a router to assign queries to the most appropriate expert module. It's crucial for the LLM to know when and how to use these symbolic tools, which can be more reliable than attempting to solve issues directly within the LLM's framework.

Additionally, Tool Augmented Language Models (TALM) and Toolformer frameworks fine-tune LLMs to learn how to use external tool APIs effectively. These models are evaluated by determining whether newly integrated API call annotations improve model output quality. Some practical implementations are the ChatGPT Plugins and OpenAI API function calling. In such cases, tool APIs might be provided by other developers or be self-defined.

Another example is HuggingGPT, a framework where ChatGPT acts as a task planner selecting models from the Hugging Face platform based on model descriptions. This framework operates in several stages, including task planning where the LLM interprets user requests into tasks, each with specific attributes such as task type, ID, dependencies, and arguments.

Furthermore, LLM-powered autonomous agent systems rely on external APIs to provide additional information that may not be available within the model's parameters, such as current data, code execution capabilities, or access to proprietary data sources. External APIs expand the model's capacity for memory retention and recall, aiding long-term memory by offering access to a broader array of information beyond the preset model weights.",0.003042,7009990.0,"Relevant Content:
Autonomous agents utilize a modular approach, integrating LLMs with various ""expert"" modules in what is known as a MRKL system. The general-purpose LLM acts as a router to direct queries to the most appropriate expert modules, which can be either neural (e.g., deep learning models) or symbolic (e.g., math calculator, currency converter, weather API). Experiments have shown that while it is challenging for LLMs to solve verbal math problems due to difficulty in extracting arguments for arithmetic, external symbolic tools can work effectively if the LLM knows when and how to use them.

Both TALM (Tool Augmented Language Models; Parisi et al., 2022) and Toolformer (Schick et al., 2023) involve fine-tuning a language model to utilize external tool APIs. The quality of outputs improves with the addition of new API call annotations. Examples include ChatGPT Plugins and OpenAI API function calling, where LLMs are augmented with tool use capability in practice. The APIs can either be third-party provided or self-defined.

HuggingGPT, proposed by Shen et al. in 2023, uses ChatGPT as a task planner, selecting models from the Hugging Face platform according to model descriptions and summarizing results based on the execution outcomes.

In this system, external tools can provide additional information missing from the pre-trained model, granting capabilities such as accessing current information, executing code, and retrieving proprietary information. The system involves four stages:
1. Task planning where LLM serves as the brain, parsing user requests into manageable tasks.
2. Execution of tasks using external models or APIs.
3. Summarization of results.
4. Presentation of findings.

These functionalities underline the capability of LLMs to interact with external tools effectively, enhancing their potential as problem solvers in various domains.",8.927999999999999e-05,5406924.0,9.0,9.0
3,What methods are used to enable LLMs to self-reflect and refine their outputs?,"Techniques to enhance large language models' ability to self-assess and improve their responses involve the use of natural language as an interface between LLMs and external components like memory and tools. The reliability of model outputs is often questioned due to potential errors like formatting mistakes and rebellious behavior, prompting a focus on parsing the model output. Various approaches are employed:

1. **Chain of Thought Prompting**: This encourages reasoning in LLMs by structured prompting techniques.
   
2. **Tree of Thoughts**: Deliberate problem-solving with large language models that involve systematic approaches.

3. **Chain of Hindsight**: Aligning LLMs with feedback through iterative learning and adjustment processes.

4. **Planning Proficiencies**: Empowering LLMs by enhancing their planning capabilities, ensuring they can determine optimal actions or steps.

5. **ReAct Framework**: This synergizes reasoning and acting processes within LLMs, enhancing their decision-making capabilities.

6. **Token Manipulations**: Using adversarial writing interfaces, where the significance of words is analyzed through gradients, helping the model correct mistakes by understanding the importance of tokens.

7. **MRKL Systems**: These involve using a general-purpose LLM as a router to direct inquiries to various specialized expert modules.

8. **Tool-Augmented Models**: Fine-tuning LLMs to use external tool APIs efficiently, as demonstrated by TALM and Toolformer frameworks.

9. **ChatGPT Plugins and API Functions**: These augment LLM capabilities by integrating external API tools to resolve specific inquiries effectively.

Through these methods, LLMs are aligned to perform tasks more effectively and reliably by leveraging structured reasoning, feedback alignment, and external tool augmentation.",0.007647,12076728.0,"Large Language Models (LLMs) achieve iterative improvement in their generated text through a process known as the Chain of Hindsight (CoH). CoH involves presenting the model with a sequence of past outputs, each annotated with feedback, to encourage the model to improve on its own outputs. Human feedback data involves a collection of tuples, where each tuple contains the prompt, a model completion, a human rating of the completion, and corresponding human-provided hindsight feedback. The feedback tuples are ranked by reward, indicating the quality of the completion.

The process involves fine-tuning the model in a supervised manner, using a series of feedback sequences. The model is trained to predict more desirable outcomes, conditioned on the feedback sequence. This allows the model to self-reflect and produce better outputs if given feedback that represents a sequence of improvements. To avoid overfitting and ensure the model does not simply memorize the feedback sequences, some tokens from past sequences are masked randomly during training.

Upon completing this fine-tuning process, the model can perform better by following instructions to produce outputs with incremental improvements. This iterative improvement mechanism fosters a kind of self-awareness, as the model learns from its historical performance and the guidance provided through feedback sequences.",8.720999999999999e-05,5983410.0,9.0,7.0
4,How does few-shot learning improve performance compared to zero-shot learning in prompt engineering?,"Few-shot learning in prompt engineering often leads to better performance than zero-shot learning because it allows the model to first see good examples, helping it better understand human intention and the criteria for desired answers. This method enables the model to perform tasks more effectively as it receives additional context through demonstrations, which clarifies the task and expectations compared to zero-shot learning, where the model is only given the task description. However, the trade-off includes increased token consumption and the potential to exceed context length limits when dealing with lengthy input and output text.",0.008019,7558176.0,"In the realm of prompt engineering, few-shot learning and zero-shot learning represent two fundamental methods for guiding language model behavior. Few-shot learning provides a set of high-quality demonstrations with both input and output for the target task, which helps the model to better understand human intention and criteria, often leading to better performance than zero-shot learning. The key factors contributing to this difference include the ability of the model to see good examples first, thus allowing it to understand desired outcomes more effectively. However, few-shot learning requires more tokens and could reach the context length limit with long input and output texts.

Zero-shot learning, on the other hand, involves asking the model to generate results based solely on the task text, without examples. This approach is less effective compared to few-shot learning because it lacks the additional context provided by examples which guide the model towards generating more accurate responses.

Several studies, such as those by Zhao et al. (2021), have highlighted factors that contribute to performance variability in few-shot learning, such as the choice of prompt format, training examples, and the ordering of these examples. These factors can dramatically influence performance, ranging from near random guesses to near state-of-the-art results. Some noted biases include:

1. **Majority Label Bias**: Issues arise when there's an imbalance in label distribution among examples.
2. **Recency Bias**: The tendency of the model to repeat the label at the end of the provided examples.
3. **Common Token Bias**: Models tend to produce more common tokens rather than rare ones.

To tackle these biases, methods have been proposed to calibrate the label probabilities output by the models to ensure they remain uniform, especially for inputs that don't provide explicit answers.

In conclusion, the distinction between few-shot and zero-shot learning in prompt engineering hinges on the structured guidance provided by few-shot examples, which often results in improved model performance by offering more context and reducing ambiguity in tasks. However, balancing token usage and mitigating biases are essential for optimizing this approach.",9.341999999999998e-05,7301069.0,10.0,9.0
5,What are the benefits and challenges of integrating LLMs with external APIs for problem-solving?,"Advantages of combining large language models (LLMs) with external APIs for enhanced problem-solving capabilities include:

1. **Enhanced Functionality**: By integrating with external APIs, LLMs can leverage specialized tools and databases, allowing for more robust and accurate responses. For example, MRKL systems incorporate a collection of expert modules that the LLM routes inquiries to, depending on the task, such as a math calculator or currency converter. 

2. **Improved Problem Solving**: Systems such as HuggingGPT use LLMs to parse user requests into multiple tasks, utilizing models from platforms like HuggingFace. This modular approach can tackle complex solutions by breaking them into manageable sub-tasks that the LLM plans and orchestrates.

3. **Augmented Capability**: Language models such as TALM (Tool Augmented Language Models) and Toolformer are fine-tuned to use external tool APIs effectively, which enhances the model's output by incorporating additional data or performing specialized operations like calculations.

4. **Real-world Application**: Practical applications of LLMs augmented through external APIs include ChatGPT Plugins and OpenAI API function calling, which are already in use to extend the model's native capabilities by tapping into updated and specialized datasets.

Potential difficulties include:

1. **Reliability of Outputs**: LLMs may demonstrate issues such as formatting errors or deviance from intended tasks (rebellious behavior), affecting the reliability of outputs when working with external APIs. 

2. **Complex Integration**: Determining when and how to apply external tools effectively depends largely on the LLM's capability, requiring significant fine-tuning and precise integration to ensure seamless operation across different modules.

3. **Discrepancy in Information**: When an LLM with a pre-established knowledge base combines with external APIs accessing more recent or specialized data, discrepancies can occur that might misalign the contextual information with the model's internal knowledge.

4. **Technical Challenges**: Integrating APIs like those in TALM requires setting up language models to handle tool-call sequences correctly, which may involve developing extensive training datasets and fine-tuning the models, posing significant technical overhead.

These insights into the integration of LLMs and external APIs illustrate the balance between enhanced problem-solving capabilities and the intricacies of reliable implementation.",0.0031139999999999,2829015.0,"Connecting Large Language Models (LLMs) to external APIs involves several advantages and disadvantages, which influence their effectiveness in solving complex problems. Here are some of the key insights from the content retrieved:

Advantages:
1. **Task Specialization**: LLMs can serve as a central organizer, routing tasks to specialized modules or external tools best suited for specific tasks. This allows for leveraging the strengths of specialized APIs and models to achieve better results.
2. **Performance Enhancement**: By integrating with external APIs, LLMs can enhance their capabilities beyond their native abilities. For instance, with access to a calculator API, an LLM can effectively handle arithmetic which might be challenging otherwise.
3. **Efficiency in Task Execution**: Frameworks like HuggingGPT use LLMs as task planners, decomposing high-level tasks into manageable steps and selecting models or APIs that can best handle each step.
4. **Shared Resources**: In implementations like API-Bank, a diverse range of APIs can be called by LLMs, potentially covering a vast array of tasks from calendar management to smart home control, thus expanding the utility of LLMs.

Disadvantages:
1. **Efficiency Concerns**: Interaction with external APIs can introduce delays, as both the LLM inference rounds and API calls contribute to the time taken for processing a task.
2. **Dependency on Long Contexts**: Solving complex problems often requires maintaining a long context, which can be cumbersome and limit the model's efficiency.
3. **Stability and Reliability**: Reliance on external systems means the overall performance hinges on not just the LLM but also the stability and reliability of the API responses and services.
4. **Complex Decision-Making**: As seen in API-Bank, the need for LLMs to accurately decide when and how to call APIs adds layers of complexity, requiring precise planning, retrieval, and response generation.

Key Factors Influencing Trade-offs:
1. **Capability of the LLM**: The inherent ability of an LLM to interpret tasks, and determine the necessity and modality of API calls influences how effectively it can leverage external tools.
2. **API Quality and Availability**: The robustness, scope, and reliability of available APIs are critical. An LLM's performance could degrade if the APIs are not up to the mark.
3. **Task Complexity**: The nature of tasks, whether they require straightforward API calls or intricate planning and execution strategies across multiple APIs, plays a significant role.
4. **Evaluation Metrics**: The benchmarks and evaluation mechanisms (like human expert evaluations versus self-evaluation of LLMs) impact the perceived efficiency and correctness of solutions formulated using APIs.

Thus, while connecting LLMs to external APIs presents a potent avenue for extending their usability and addressing more complex problem statements, it necessitates careful consideration of various influencing factors to mitigate potential drawbacks.",9.603e-05,5487784.0,9.0,10.0
