Unnamed: 0,question,single_answer,single_cost,single_duration,routed_answer,routed_cost,routed_duration,single_score,routed_score
6,What is the difference between short-term memory and long-term memory in LLM-based systems?,"In large language model (LLM) systems, memory is divided into short-term and long-term memory:

1. **Short-term memory**: This involves the model's in-context learning capabilities. It allows the LLM to learn and retain information temporarily while engaging in tasks, such as during a single session or interaction with the text. This type of memory is essential for handling the tasks at hand without permanently storing the information.

2. **Long-term memory**: This provides the system with the ability to retain and recall information over extended periods. LLMs often leverage external vector stores and fast retrieval mechanisms to achieve this long-term retention. This type of memory is crucial for maintaining knowledge that remains accessible for future interactions across various sessions, effectively allowing the LLM to build upon its knowledge base over time.

These memory types enable LLM-powered autonomous agents to perform complex reasoning tasks, learn, and evolve their problem-solving strategies over time.",0.0026639999999999,2359363.0,"In the context of large language models (LLMs), short-term and long-term memory mechanisms play critical roles in determining the model's capabilities and limitations. 

**Short-term memory** in LLMs is primarily associated with in-context learning, which is a process where the model utilizes the immediate context provided within a conversation or text to learn and make predictions. This form of memory is crucial for handling tasks that require immediate attention and response, such as maintaining context in a conversation or understanding the flow of a narrative during a single session of interaction. However, short-term memory is limited to the session and doesn't persist beyond it, which can sometimes lead to limitations in continuity across interactions if long-term memory is not properly integrated.

**Long-term memory**, on the other hand, allows LLMs to retain and recall information across different sessions over extended periods. This is often implemented by leveraging an external vector store, along with techniques like Maximum Inner Product Search (MIPS) for fast retrieval. Long-term memory endows LLMs with the ability to ""remember"" information or learnings from past interactions, making it particularly useful for applications where continuous learning and adaptation are required. It effectively mitigates the short-term memory limitation by allowing information retention beyond single interactions.

The differences between these memory types significantly impact the capabilities and limitations of LLMs. Short-term memory limitations can restrict the model's ability to perform tasks that require persistent knowledge across multiple interactions. However, with long-term memory, such limitations are partially addressed, allowing LLMs to be used in more complex applications that involve cumulative learning over time.

This dual-memory mechanism aims to mirror human-like memory processes, where short-term memory is used for processing current information and interactions, while long-term memory builds a knowledge base over time. This combined memory function enhances the overall efficacy of LLMs, enabling them to handle a wider variety of tasks and improving their efficiency in problem-solving and task automation.

Thus, the interplay of short-term and long-term memory in LLMs defines their operational scope, helping bridge the gap between isolated task execution and the kind of continuous, context-aware interaction that is more typical of human cognition.",9.593999999999998e-05,4021451.0,9.0,9.0
7,What strategies are recommended for constructing effective in-context examples in prompt engineering?,"Best practices for impactful in-context examples in prompt engineering include understanding and mitigating biases such as majority label bias, recency bias, and common token bias. Choose semantically similar examples using techniques like k-NN clustering and ensure diversity with graph-based approaches. Train embeddings via contrastive learning to refine selection. Order examples randomly to avoid bias, and leverage active learning to select examples with high disagreement. These strategies improve the model's comprehension and response capabilities.",0.0026639999999999,3043019.0,"To design effective in-context examples for improving the performance and relevance of large language models when using prompt engineering, follow these strategies:

1. **Few-shot Learning**: Utilize a method where a set of high-quality demonstrations are presented. Each demonstration should include both the input and the desired output on the target task. This helps in providing clear guidance to the model.

2. **Example Selection and Ordering**: Carefully select and order examples to ensure the model does not produce unbalanced predictions or become overly confident. Tips for example selection include choosing diverse, representative tasks that mirror the range of tasks the model will encounter in the deployment setting.

3. **Instruction Prompting**: Present a few-shot example in the prompt to explain the intent clearly. While few-shot prompting can be costly in terms of tokens, instruction prompting converts task instructions into machine-understandable demonstrations. 

4. **In-Context Instruction Learning**: This approach combines few-shot learning and instruction prompting by integrating multiple demonstration examples across different tasks within the prompt. Each demonstration provides an instruction, task input, and output, helping the model generalize across varied contexts.

These strategies align the model’s understanding and enhance its ability to perform desired tasks effectively, as demonstrated in studies like ""Learning to retrieve prompts for in-context learning"" and ""In-Context Instruction Learning"".",8.73e-05,5845283.0,8.0,9.0
8,How does the Tree of Thoughts (ToT) framework expand upon Chain of Thought reasoning?,"The Tree of Thoughts (ToT) framework enhances or builds upon the principles of Chain of Thought (CoT) reasoning by expanding its approach to problem-solving. The CoT technique involves instructing a model to ""think step by step,"" effectively breaking down complex tasks into smaller, manageable steps for better interpretation and performance. ToT, on the other hand, extends this idea by exploring multiple reasoning possibilities at each step, effectively creating a tree structure. The framework facilitates a search process that can be conducted through methods like breadth-first search (BFS) or depth-first search (DFS), with each state being evaluated either by a classifier or a majority vote. The decomposition of tasks in the ToT framework can be achieved through multiple methods such as prompting large language models (LLMs), using task-specific instructions, or human input. This extension of CoT allows ToT to deliberate multiple potential paths to solving a problem, thus enriching the model's reasoning capabilities and enabling it to handle more complex scenarios.",0.0105929999999999,13705510.0,"The Tree of Thoughts framework improves upon Chain of Thought reasoning by extending the idea of decomposing complex tasks into multiple manageable steps, similar to Chain of Thought (CoT), but goes further by exploring multiple reasoning possibilities at each step. It transforms the reasoning process into a tree structure, where each decision point can branch out into different possible thoughts. This allows the model to generate multiple thoughts per step, thus expanding the exploration space and capturing a wider range of potential solutions. The problem-solving technique involves creating a tree where the search process can be conducted via either breadth-first search (BFS) or depth-first search (DFS). Each state in this process is evaluated using a classifier (through a prompt) or a majority vote to determine the most promising direction for further exploration. This framework not only structures the reasoning process into a coherent form but also increases the comprehensiveness of the reasoning by considering multiple possibilities.",8.585999999999998e-05,5033575.0,10.0,9.0
9,What are some proof-of-concept examples of autonomous agents powered by LLMs?,"Natural language serves as an interface between Large Language Models (LLMs) and external components such as memory and tools, although the reliability of LLM outputs can be questionable due to potential formatting errors and instances of rebellious behavior. Therefore, much of the agent demo code concentrates on parsing model output.

One notable system is the MRKL system, which incorporates a collection of “expert” modules, with a general-purpose LLM acting as a router, directing inquiries to the most suitable expert module. These modules may be neural (e.g., deep learning models) or symbolic (e.g., a math calculator, currency converter, weather API). Experiments involving the fine-tuning of LLMs to utilize calculators seem to indicate that while explicitly stated math problems are easily managed, verbal math problems are more challenging due to extracting the correct arguments for basic arithmetic.

Both TALM (Tool Augmented Language Models) and Toolformer have taken steps to fine-tune LMs for using external tool APIs, illustrating how a dataset can expand through the addition of API call annotations which in turn enhance the quality of model outputs. 

Furthermore, the use of ChatGPT Plugins and OpenAI API function calling exemplifies LLMs augmented with tool use capabilities working effectively in practice. These tools can either be externally provided by other developers (as seen with Plugins) or self-defined (as occurs with function calls).

HuggingGPT represents another innovative framework, employing ChatGPT as the task planner to select models available on the HuggingFace platform based on model descriptions and to summarize responses generated from execution results. HuggingGPT operates through four distinct stages:

1. Task planning: Here, the LLM acts as the brain, parsing user requests into multiple tasks, each with four key attributes: task type, ID, dependencies, and arguments. Few-shot examples are employed to guide the LLM in task parsing and planning.

These examples of autonomous agents showcase the evolving landscape of integrating LLMs in various task-oriented demonstrations.",0.0027329999999999,2521817.0,"LLM Powered Autonomous Agents

In the exploration of LLM-powered autonomous agents, several proof-of-concepts have been demonstrated, such as AutoGPT, GPT-Engineer, and BabyAGI, which highlight the potential of LLMs as powerful general problem solvers beyond simply generating content. These agents utilize LLMs as their core controllers with a system made up of key components like planning, memory, and tool use.

1. **Agent System Overview:**
   - **Planning:** Involves subgoal creation and task decomposition, enabling efficient handling of complex tasks. It includes reflection and refinement for learning from mistakes and improving future results.
   - **Memory:** Comprises short-term (in-context learning) and long-term memory, allowing the agent to retain and recall extensive information.
   - **Tool Use:** The agent learns to interact with external APIs for acquiring additional information not contained within the model, such as current data or proprietary sources.

2. **Challenges:** Despite the potential capabilities, the reliability of LLM outputs is sometimes questionable due to formatting errors or unpredictable behaviors, which necessitates considerable focus on parsing model outputs.

3. **Scientific Discovery Case Study:**
   - An LLM model, requested to develop a novel anticancer drug, showed reasoning capabilities by inquiring about current trends, selecting targets, and attempting synthesis—demonstrating both potential application and associated risks.

4. **Generative Agents Simulation:**
   - A notable experiment featured 25 virtual characters in a sandbox environment, inspired by ""The Sims,"" each controlled by an LLM-powered agent. These generative agents aim to recreate realistic human behavior for interactive applications, employing memory streams (long-term memory modules) and retrieval models to inform agent behaviors based on relevance, recency, and importance of events.

These demonstrations underscore both the promising applications and limitations of LLMs in constructing autonomous agents capable of complex tasks and interactions.

For more detailed insights, please see ""LLM-powered Autonomous Agents"" by Lilian Weng.",8.783999999999999e-05,4196454.0,8.0,9.0
10,How do autonomous agents handle task prioritization and resource allocation?,"In a LLM-powered autonomous agent system, tasks and resources are effectively optimized through a few key mechanisms:

1. **Planning**: The agent breaks down large tasks into smaller subgoals, enabling efficient handling of complex tasks. This includes both subgoal decomposition and self-reflection to critique past actions and refine future steps.

2. **Memory**:
   - **Short-term memory** is employed via in-context learning.
   - **Long-term memory** allows retention and retrieval of information over time, typically utilizing an external vector store for fast access.

3. **Tool Use**: Agents learn to call external APIs to obtain information not present within the model weights, including real-time data, code execution capabilities, and access to proprietary information sources.

4. **Task Decomposition**: Utilizing techniques like the Chain of Thought (CoT), the agent breaks down complex tasks into manageable steps and considers multiple solutions at each step. This may extend to the Tree of Thoughts for exploring multiple reasoning paths and could involve an external classical planner for long-horizon planning if required.

5. **Self-Reflection**: The agent continuously learns from past actions, refining decisions and correcting mistakes to improve task handling in real-world applications.

These components collectively enable an LLM-powered autonomous agent to optimize performance by effectively prioritizing and allocating resources across varying tasks.",0.013824,12831437.0,"In LLM-powered autonomous agent systems, task prioritization and resource allocation are managed through several interconnected components and strategies:

1. **Planning**: This involves breaking down complex tasks into smaller, manageable subgoals, which helps agents handle tasks more efficiently. The agent system's brain, consisting of a Large Language Model (LLM), orchestrates this planning, considering the requisite steps and planning ahead for effective execution.

2. **Task Decomposition**: Utilizing techniques like Chain of Thought (CoT), which involves thinking step by step, agents transform larger tasks into simpler, manageable tasks. This helps in clarifying the agent's thinking process and distributing tasks in smaller tasks for better management and execution.

3. **Self-Reflection and Learning**: Autonomous agents use self-reflection to critique and analyze their past actions. This helps in learning from mistakes and enhancing decision-making, which in turn optimizes future task execution. The agent refines its strategies based on previous experiences to improve efficiency.

4. **Memory Utilization**: Agents employ both short-term and long-term memories. Short-term memory aids in in-context learning during tasks, while long-term memory, often supported by an external vector store, ensures agents can retain and retrieve information over time, facilitating informed decision-making and resource allocation.

5. **Tool Use and External Assistance**: When required, agents can call upon external APIs and tools to supplement their capabilities. This includes fetching real-time information or executing tasks that require specific, possibly proprietary, data or capabilities beyond the agent's initial programming.

Through these mechanisms, autonomous agents prioritize tasks based on decomposed subgoals, utilize reflection to iteratively improve, access memories for context-driven decisions, and employ external tools for comprehensive task management, ensuring resource allocation maximizes efficiency towards achieving their goals.",9.225e-05,6204936.0,8.0,9.0
11,What role does retrieval-augmented generation (RAG) play in improving LLM responses?,"Retrieval-augmented generation (RAG) is a framework that enhances the performance of large language models (LLMs) by integrating retrieval mechanisms to provide external information when generating responses. This combination allows LLMs to generate outputs with improved quality and accuracy. By using retrieval systems, the LLMs can reference vast databases of information, providing responses that are informed by specific and up-to-date data that may not be stored within the model's parameters. This approach leads to more informed, relevant, and precise answers, as the retrieval component can address information gaps or outdated knowledge in the model. Essentially, RAG strengthens LLM capacity to generate contextually accurate responses through a dynamic and scalable information-seeking process, leveraging vast external datasets.",0.235647,136333084.0,"The application of retrieval-augmented generation (RAG) involves querying a predefined knowledge base and integrating the retrieved information into the prompt for LLMs. This combination enhances the accuracy and quality of the outputs by supplementing the model's pre-existing knowledge base with external, relevant data. Typically, the process is divided into two main steps: retrieval and generation. The retrieval step focuses on identifying the most pertinent information available from external sources, while the generation step uses this information to formulate a comprehensive answer or output.

For example, a study by Lazaridou et al. (2022) utilized Google Search for document retrieval to augment LLMs. Given a question, clean text is extracted from the top search results, which are then processed and ranked for relevance. The most relevant paragraphs are included in the prompt, enhancing the model's ability to generate accurate answers. Different techniques such as TF-IDF ranking, noisy channel inference, and product-of-experts models can be employed to optimize the retrieval-to-generation pipeline, each with varying degrees of success.

This process ensures that the model's output is informed by the latest and most accurate data, compensating for any limitations in the model's original training data. By integrating external knowledge sources, RAG aids LLMs in producing more accurate, contextually relevant, and informed responses, particularly when dealing with topics requiring up-to-date information.",9.422999999999998e-05,5537233.0,10.0,10.0
12,How can we implement effective error handling and recovery in autonomous agent systems?,"In a LLM-powered autonomous agent system, enhancing error handling and recovery mechanisms involves several strategies:

1. **Planning**: The agent employs task decomposition and self-reflection. By breaking down large tasks into manageable subgoals, the agent can handle complex tasks more efficiently. Self-criticism and reflection allow the agent to review past actions, learn from mistakes, and refine its approach for better future performance.

2. **Memory Management**: The system utilizes both short-term and long-term memory. Short-term memory involves in-context learning, enabling the model to remember relevant information temporarily. Long-term memory, often supported by an external vector store, enables the agent to retain and recall extensive information over time.

3. **Tool Use**: Agents learn to use external APIs to acquire missing information not available in the model weights, such as current data, code execution capabilities, and access to proprietary sources. This mitigates issues arising from incomplete knowledge within the model.

4. **Reliability Improvement**: Since model outputs might contain errors, much of the agent's code focuses on parsing and verifying model outputs to ensure reliable performance.

These components work together to enhance the robustness and error resilience of autonomous agent systems, allowing for effective error handling and recovery in dynamic environments.",0.0026939999999999,2852134.0,"In designing robust and adaptable error handling and recovery mechanisms for autonomous agents, particularly those powered by large language models (LLMs), several considerations and strategies come into play:

1. **Planning and Decomposition**: Agents can be programmed to decompose complex tasks into smaller, manageable sub-tasks. This allows for more efficient management of tasks and potential failure points, enabling the system to isolate and address errors within specific sub-tasks without disrupting the entire process.

2. **Reflection and Refinement**: Incorporating self-reflection mechanisms enables agents to evaluate past actions, learn from errors, and refine their strategies. By continually learning from mistakes and adjusting strategies accordingly, agents can improve their performance over time.

3. **Memory Systems**: Differentiating between short-term and long-term memory can improve an agent's ability to handle and recover from errors. Short-term memory facilitates immediate learning and adjustment within a session, whereas long-term memory assists in recalling persistent data that might be necessary for task completion and learning from previous experiences.

4. **Tool Use and Adaptability**: Providing agents with the ability to call external APIs or tools allows them to gather additional needed information and capabilities that are not inherent within the pre-trained model weights. This adaptability can help resolve errors originating from gaps in the agent's initial training dataset.

5. **Output Parsing and Reliability Checks**: Since LLM-based agents operate through natural language instructions and generate human-like outputs, implementing strict parsing mechanisms and reliability checks are essential. These systems can monitor outputs for compliance with expected formats and check for non-compliant or error-prone responses, occasionally overriding the model output if necessary to maintain system goals.

6. **Simulations and Testing Frameworks**: By creating simulation environments, agents can be tested under various scenarios to identify potential failure modes. These simulations help predict and mitigate the impact of diverse failures, improving overall system robustness.

In summary, by combining strategic task management, continuous learning, adaptive memory use, versatile tool integration, and rigorous validation of agent outputs, we can design autonomous systems that not only react to but also learn from errors to achieve their goals effectively.",0.0330033,26803364.0,8.0,9.0
